<!DOCTYPE api-data SYSTEM '../../dtd/api-data.dtd'>
<api-data>
    <api-path>/lobby</api-path>
    <http-request />
    <main-class>
        <class class-name="ExitRoomResponse">
            <description>大厅创建房间响应</description>
            <int>
                <key>code</key>
                <description>响应代码: -1: fail, 0: success</description>
            </int>
        </class>
    </main-class>
</api-data>